<?xml version="1.0"?>
<!-- Code generation module configuration -->
<module
	xmlns:xsi="http://www.w3.org/2001/XMLSchema-instance"
	xsi:noNamespaceSchemaLocation=" https://schema.flowcentralplatform.com/xsd/4.2.0/flowcentral-module.xsd"
	name="codegeneration" description="$m{codegeneration.module}" shortCode="CDN"
	label="$m{codegeneration.label}">
	<!-- applications -->
	<applications>
		<application name="codegeneration"
			shortDescription="$m{codegeneration.short.description}"
			longDescription="$m{codegeneration.long.description}" autoInstall="true"
			configFile="apps/codegeneration-application.xml" />
	</applications>

	<!-- System Parameters -->
	<sysParameters>
		<sysParameter code="CDN-0001" defaultVal="com.flowcentraltech.flowcentral"
			description="$m{codegeneration.sysparam.codegenpackagebase}"
			editor="!ui-text maxLen:128" type="STRING" editable="true" />
		<sysParameter code="CDN-0002"
			description="$m{codegeneration.sysparam.messagereplacementlist}"
			editor="!ui-textarea" type="STRING" editable="true" />
		<sysParameter code="CDN-0003" defaultVal="false"
			description="$m{codegeneration.sysparam.codegenskippasswordfields}"
			editor="!ui-select list:booleanlist" type="BOOLEAN" editable="true" />
		<sysParameter code="CDN-0004"
			description="$m{codegeneration.sysparam.extensionspath}"
			editor="!ui-text maxLen:128" type="STRING" editable="true" />
		<sysParameter code="CDN-0005"
			description="$m{codegeneration.sysparam.utilitiespath}"
			editor="!ui-text maxLen:128" type="STRING" editable="true" />
		<sysParameter code="CDN-0006"
			description="$m{codegeneration.sysparam.codegenrepository}"
			editor="!ui-select list:$s{remoterepoconfiglist} listKey:$s{name} blankOption:$s{}"
				type="STRING" editable="true" />
		<sysParameter code="CDN-0007" defaultVal="development"
			description="$m{codegeneration.sysparam.codegenbranch}"
			editor="!ui-text maxLen:128" type="STRING" editable="true" />
		<sysParameter code="CDN-0008" defaultVal="false"
			description="$m{codegeneration.sysparam.codegentorepository}"
			editor="!ui-select list:booleanlist" type="BOOLEAN" editable="true" />			
		<sysParameter code="CDN-0009"
			description="$m{codegeneration.sysparam.snapshotpath}"
			editor="!ui-text maxLen:128" type="STRING" editable="true" />
		<sysParameter code="CDN-0010"
			description="$m{codegeneration.sysparam.snapshotrepository}"
			editor="!ui-select list:$s{remoterepoconfiglist} listKey:$s{name} blankOption:$s{}"
				type="STRING" editable="true" />
		<sysParameter code="CDN-0011" defaultVal="development"
			description="$m{codegeneration.sysparam.snapshotbranch}"
			editor="!ui-text maxLen:128" type="STRING" editable="true" />
		<sysParameter code="CDN-0012" defaultVal="false"
			description="$m{codegeneration.sysparam.snapshottorepository}"
			editor="!ui-select list:booleanlist" type="BOOLEAN" editable="true" />
		<sysParameter code="CDN-0013"
			description="$m{codegeneration.sysparam.snapshotslocalfolder}"
			editor="!ui-text maxLen:128" type="STRING" editable="true" />
		<sysParameter code="CDN-0014" defaultVal="true"
			description="$m{codegeneration.sysparam.enablesnapshotslocalfolder}"
			editor="!ui-select list:booleanlist" type="BOOLEAN" editable="true" />
		<sysParameter code="CDN-0015" defaultVal="true"
			description="$m{codegeneration.sysparam.publishallworkflowoncodegen}"
			editor="!ui-select list:booleanlist" type="BOOLEAN" editable="true" />
	</sysParameters>
</module>