<?xml version="1.0"?>
<!-- Master report module configuration -->
<module
	xmlns:xsi="http://www.w3.org/2001/XMLSchema-instance"
	xsi:noNamespaceSchemaLocation=" https://schema.flowcentralplatform.com/xsd/4.2.0/flowcentral-module.xsd"
	name="report" description="$m{report.module}" shortCode="RPT"
	label="$m{report.label}">
	<!-- Applications -->
	<applications>
		<application name="report"
			shortDescription="$m{report.short.description}"
			longDescription="$m{report.long.description}" autoInstall="true"
			configFile="apps/report-application.xml" />
	</applications>
	<!-- System Parameters -->
	<sysParameters>
		<sysParameter code="RPT-0001" defaultVal="web/report/templates/"
			description="$m{report.sysparam.reporttemplatepath}" editor="!ui-text size:40"
			type="STRING" editable="true"/>
		<sysParameter code="RPT-0002" defaultVal="web/images/applicationloginbanner.png"
			description="$m{report.sysparam.reportclientlogo}" editor="!ui-text size:40"
			type="STRING" editable="true"/>
		<sysParameter code="RPT-0003" defaultVal="dynamicreportportrait.jrxml"
			description="$m{report.sysparam.dynamicreportportraittemplate}"
			editor="!ui-text size:40" type="STRING" editable="true"/>
		<sysParameter code="RPT-0004" defaultVal="dynamicreportlandscape.jrxml"
			description="$m{report.sysparam.dynamicreportlandscapetemplate}"
			editor="!ui-text size:40" type="STRING" editable="true"/>
		<sysParameter code="RPT-0005" defaultVal="2"
			description="$m{report.sysparam.reportlistingcolumns}"
			editor="!ui-select list:onetotenlist" type="NUMBER" editable="true"/>
	</sysParameters>
</module>