<?xml version="1.0"?>
<!-- Workflow module configuration -->
<module
	xmlns:xsi="http://www.w3.org/2001/XMLSchema-instance"
	xsi:noNamespaceSchemaLocation=" https://schema.flowcentralplatform.com/xsd/4.2.0/flowcentral-module.xsd"
	name="workflow" description="$m{workflow.module}" shortCode="WRK"
	label="$m{workflow.label}">
	<!-- Applications -->
	<applications>
		<application name="workflow"
			shortDescription="$m{workflow.short.description}"
			longDescription="$m{workflow.long.description}" autoInstall="true"
			configFile="apps/workflow-application.xml" />
		<application name="workflowDraft"
			shortDescription="$m{workflow.draft.short.description}"
			longDescription="$m{workflow.draft.long.description}" autoInstall="true"
			configFile="apps/workflow-draft-application.xml" />
	</applications>

	<!-- System Parameters -->
	<sysParameters>
		<sysParameter code="WF-0001" defaultVal="64"
			description="$m{workflow.sysparam.processingbatchsize}"
			editor="!ui-integer precision:2" type="NUMBER" editable="true" />
		<sysParameter code="WF-0002" defaultVal="64"
			description="$m{workflow.sysparam.autoloadingbatchsize}"
			editor="!ui-integer precision:2" type="NUMBER" editable="true" />
		<sysParameter code="WF-0003" defaultVal="true"
			description="$m{workflow.sysparam.enableupdateonreview}"
			editor="!ui-select list:booleanlist" type="BOOLEAN" editable="true" />
		<sysParameter code="WF-0004" defaultVal="true"
			description="$m{workflow.sysparam.enableautoloading}"
			editor="!ui-select list:booleanlist" type="BOOLEAN" editable="true" />
		<sysParameter code="WF-0005" defaultVal="64"
			description="$m{workflow.sysparam.itemalertbatchsize}"
			editor="!ui-integer precision:2" type="NUMBER" editable="true" />
		<sysParameter code="WF-0006" defaultVal="196"
			description="$m{workflow.sysparam.itemejectionbatchsize}"
			editor="!ui-integer precision:4" type="NUMBER" editable="true" />
		<sysParameter code="WF-0007" defaultVal="true"
			description="$m{workflow.sysparam.enableexternaluseraction}"
			editor="!ui-select list:booleanlist" type="BOOLEAN" editable="true" />
	</sysParameters>
</module>